,symbol,company_name,score,buy,hold,sell,price_target,current,upside
1565,HLI,"Houlihan Lokey, Inc. Class A Common Stock",1.67,no,4,2,88.0,108.41,-0.188
1566,HLM$,Hillman Group Capital Trust Preferred Stock,n/a,n/a,n/a,n/a,n/a,n/a,n/a
1567,HLT,Hilton Worldwide Holdings Inc. Common Stock ,2.4,6,9,no,137.53,135.45,0.015
1568,HLX,"Helix Energy Solutions Group, Inc. Common Stock",1.67,no,2,1,4.75,2.98,0.594
1569,HMC,"Honda Motor Company, Ltd. Common Stock",n/a,n/a,n/a,n/a,n/a,n/a,n/a
1570,HMG,"HMG/Courtland Properties, Inc. Common Stock",n/a,n/a,n/a,n/a,n/a,n/a,n/a
1571,HMI,"Huami Corporation American Depositary Shares, each representing four Class A Ordinary Shares",n/a,n/a,n/a,n/a,n/a,n/a,n/a
1572,HMLP,Hoegh LNG Partners LP Common Units representing Limited Partner Interests,1.8,1,2,2,11.0,4.05,1.716
1573,HMLP$A,Hoegh LNG Partners LP 8.75% Series A Cumulative Redeemable Preferred Units,n/a,n/a,n/a,n/a,n/a,n/a,n/a
1574,HMN,Horace Mann Educators Corporation Common Stock,2.0,no,2,no,40.0,37.28,0.073
1575,HMY,Harmony Gold Mining Company Limited,1.75,no,3,1,4.1,4.18,-0.019
1576,HNGR,"Hanger, Inc. Common Stock",n/a,n/a,n/a,n/a,n/a,n/a,n/a
1577,HNI,HNI Corporation Common Stock,3.0,1,no,no,48.0,40.27,0.192
1578,HNP,Huaneng Power Intl Common Stock,n/a,n/a,n/a,n/a,n/a,n/a,n/a
1579,HNW,Pioneer Diversified High Income Trust Pioneer Diversified High Income Trust Common Shares of Beneficial Interest,n/a,n/a,n/a,n/a,n/a,n/a,n/a
1580,HOG,"Harley-Davidson, Inc. Common Stock",2.55,8,1,2,51.96,37.76,0.376
1581,HOME,At Home Group Inc. Common Stock,2.0,no,6,no,32.6,36.99,-0.11900000000000001
1582,HON,Honeywell International Inc. Common Stock,2.6,6,4,no,236.0,204.18,0.156
1583,HOV,"Hovnanian Enterprises, Inc. Class A Common Stock",n/a,n/a,n/a,n/a,n/a,n/a,n/a
1584,HP,"Helmerich & Payne, Inc. Common Stock",2.11,6,9,4,28.32,21.87,0.295
1585,HPE,Hewlett Packard Enterprise Company Common Stock,2.46,8,3,2,17.2,14.55,0.182
1586,HPF,John Hancock Pfd Income Fund II Pfd Income Fund II,n/a,n/a,n/a,n/a,n/a,n/a,n/a
1587,HPI,John Hancock Preferred Income Fund Common Shares of Beneficial Interest,n/a,n/a,n/a,n/a,n/a,n/a,n/a
1588,HPP,"Hudson Pacific Properties, Inc. Common Stock",2.0,1,4,1,29.29,24.64,0.189
1589,HPQ,HP Inc. Common Stock,2.08,3,7,2,33.55,37.23,-0.099
1590,HPR,HighPoint Resources Corporation Common Stock,n/a,n/a,n/a,n/a,n/a,n/a,n/a
1591,HPS,John Hancock Preferred Income Fund III Preferred Income Fund III,n/a,n/a,n/a,n/a,n/a,n/a,n/a
1592,HPX.U,"HPX Corp. Units, each consisting of one Class A ordinary share and one-half of one redeemable warrant",n/a,n/a,n/a,n/a,n/a,n/a,n/a
1593,HQH,Tekla Healthcare Investors Common Stock,n/a,n/a,n/a,n/a,n/a,n/a,n/a
1594,HQL,TeklaLife Sciences Investors Common Stock,n/a,n/a,n/a,n/a,n/a,n/a,n/a
1595,HR,Healthcare Realty Trust Incorporated Common Stock,2.2,1,4,no,32.25,31.23,0.033
1596,HRB,"H&R Block, Inc. Common Stock",2.0,1,3,1,25.0,23.58,0.06
1597,HRC,Hill-Rom Holdings Inc Common Stock,2.17,1,5,no,144.0,155.68,-0.075
1598,HRI,Herc Holdings Inc. Common Stock ,2.83,5,1,no,186.75,172.1,0.085
1599,HRL,Hormel Foods Corporation Common Stock,2.0,no,4,no,43.33,42.41,0.022000000000000002
1600,HRTG,"Heritage Insurance Holdings, Inc. Common Stock",3.0,2,no,no,12.0,6.82,0.76
1601,HSBC,"HSBC Holdings, plc. Common Stock",n/a,n/a,n/a,n/a,n/a,n/a,n/a
1602,HSBC$A,"HSBC Holdings, plc. ADR SER A REP 1/40 PFD SER A",n/a,n/a,n/a,n/a,n/a,n/a,n/a
1603,HSC,Harsco Corporation Common Stock,2.5,1,1,no,24.0,14.95,0.605
1604,HST,"Host Hotels & Resorts, Inc. Common Stock",2.6,9,6,no,18.79,15.59,0.20500000000000002
1605,HSY,The Hershey Company Common Stock,2.6,6,4,no,187.0,178.1,0.05
1606,HT,Hersha Hospitality Trust Class A Common Shares of Beneficial Interest,1.83,1,3,2,9.83,8.53,0.152
1607,HT$C,Hersha Hospitality Trust 6.875% Series C Cumulative Redeemable Preferred Shares of Beneficial Interest,n/a,n/a,n/a,n/a,n/a,n/a,n/a
1608,HT$D,"Hersha Hospitality Trust 6.50% Series D Cumulative Redeemable Preferred Shares of Beneficial Interest, $0.01 par value per share",n/a,n/a,n/a,n/a,n/a,n/a,n/a
1609,HT$E,Hersha Hospitality Trust 6.50% Series E Cumulative Redeemable Preferred Shares of Beneficial Interest,n/a,n/a,n/a,n/a,n/a,n/a,n/a
1610,HTA,"Healthcare Trust of America, Inc. Class A Common Stock",2.23,3,10,no,32.1,33.93,-0.054000000000000006
1611,HTD,John Hancock Tax Advantaged Dividend Income Fund Common Shares of Beneficial Interest,n/a,n/a,n/a,n/a,n/a,n/a,n/a
1612,HTFA,Horizon Technology Finance Corporation 6.25% Notes due 2022,n/a,n/a,n/a,n/a,n/a,n/a,n/a
1613,HTGC,"Hercules Capital, Inc. Common Stock",3.0,6,no,no,18.13,16.43,0.10300000000000001
1614,HTH,Hilltop Holdings Inc.,2.0,no,4,no,32.7,34.32,-0.047
1615,HTY,John Hancock Tax-Advantaged Global Shareholder Yield Fund Common Shares of Beneficial Interest,n/a,n/a,n/a,n/a,n/a,n/a,n/a
1616,HTZ,"Hertz Global Holdings, Inc Common Stock ",n/a,n/a,n/a,n/a,n/a,n/a,n/a
1617,HUBB,Hubbell Inc Common Stock,2.0,no,2,no,200.5,200.57,-0.0
1618,HUBS,"HubSpot, Inc. Common Stock",2.96,21,2,no,795.44,776.5,0.024
1619,HUD,Hudson Ltd. Class A Common Shares,n/a,n/a,n/a,n/a,n/a,n/a,n/a
1620,HUM,Humana Inc. Common Stock,2.75,12,4,no,503.98,426.79,0.18100000000000002
1621,HUN,Huntsman Corporation Common Stock,2.77,10,3,no,38.75,32.14,0.20600000000000002
1622,HUSA,Houston American Energy Corporation Common Stock,n/a,n/a,n/a,n/a,n/a,n/a,n/a
1623,HUYA,"HUYA Inc. American depositary shares, each  representing one Class A ordinary share",2.25,5,no,3,16.93,8.25,1.052
1624,HVT,"Haverty Furniture Companies, Inc. Common Stock",n/a,n/a,n/a,n/a,n/a,n/a,n/a
1625,HVT.A,"Haverty Furniture Companies, Inc. Common Stock",n/a,n/a,n/a,n/a,n/a,n/a,n/a
1626,HWM,Howmet Aerospace Inc. Common Stock,3.0,9,no,no,36.22,27.86,0.3
1627,HWM$,Howmet Aerospace Inc. $3.75 Preferred Stock,n/a,n/a,n/a,n/a,n/a,n/a,n/a
1628,HXL,Hexcel Corporation Common Stock,1.82,no,9,2,55.0,51.77,0.062000000000000006
1629,HY,"Hyster-Yale Materials Handling, Inc. Class A Common Stock",n/a,n/a,n/a,n/a,n/a,n/a,n/a
1630,HYB,"New America High Income Fund, Inc. (The) Common Stock",n/a,n/a,n/a,n/a,n/a,n/a,n/a
1631,HYI,Western Asset High Yield Defined Opportunity Fund Inc. Common Stock,n/a,n/a,n/a,n/a,n/a,n/a,n/a
1632,HYT,"Blackrock Corporate High Yield Fund, Inc. Common Stock",n/a,n/a,n/a,n/a,n/a,n/a,n/a
1633,HZAC.U,"Horizon Acquisition Corporation Units, each consisting of one Class A Ordinary Shares and one-third of one Redeemable warrant",n/a,n/a,n/a,n/a,n/a,n/a,n/a
1634,HZN,Horizon Global Corporation Common Shares,n/a,n/a,n/a,n/a,n/a,n/a,n/a
1635,HZO,"MarineMax, Inc.  (FL) Common Stock",2.5,2,2,no,59.2,54.11,0.094
1636,IAA,"IAA, Inc. Common Stock ",n/a,n/a,n/a,n/a,n/a,n/a,n/a
1637,IAE,Voya Asia Pacific High Dividend Equity Income Fund ING Asia Pacific High Dividend Equity Income Fund Common Shares of Beneficial Interest,n/a,n/a,n/a,n/a,n/a,n/a,n/a
1638,IAF,Aberdeen Australia Equity Fund Inc Common Stock,n/a,n/a,n/a,n/a,n/a,n/a,n/a
1639,IAG,Iamgold Corporation Ordinary Shares,2.13,1,7,no,3.5,3.11,0.125
1640,IBA,"Industrias Bachoco, S.A.B. de C.V. Common Stock",3.0,2,no,no,55.5,39.55,0.40299999999999997
1641,IBIO,"iBio, Inc. Common Stock",3.0,2,no,no,2.25,0.75,2.016
1642,IBM,International Business Machines Corporation Common Stock,2.43,3,4,no,157.43,117.85,0.336
1643,IBN,ICICI Bank Limited Common Stock,n/a,n/a,n/a,n/a,n/a,n/a,n/a
1644,IBO,IBO (Listing Market - NYSE Amex Network B F) Common Stock,n/a,n/a,n/a,n/a,n/a,n/a,n/a
1645,IBP,"Installed Building Products, Inc. Common Stock",2.71,5,2,no,143.38,128.51,0.11599999999999999
1646,ICD,"Independence Contract Drilling, Inc. Common Stock",n/a,n/a,n/a,n/a,n/a,n/a,n/a
1647,ICE,Intercontinental Exchange Inc. Common Stock,3.0,8,2,no,144.2,130.94,0.10099999999999999
1648,ICL,ICL Group Ltd. Ordinary Shares,2.0,no,2,no,6.5,8.77,-0.259
1649,IDA,"IDACORP, Inc. Common Stock",2.33,2,no,1,106.0,106.82,-0.008
1650,IDE,"Voya Infrastructure, Industrials and Materials Fund Common Shares of Beneficial Interest",n/a,n/a,n/a,n/a,n/a,n/a,n/a
1651,IDT,IDT Corporation Class B Common Stock,n/a,n/a,n/a,n/a,n/a,n/a,n/a
1652,IEX,IDEX Corporation Common Stock,2.67,6,3,no,243.89,226.22,0.078
1653,IFF,"Internationa Flavors & Fragrances, Inc. Common Stock",2.73,8,3,no,154.81,144.83,0.069
1654,IFFT,"International Flavors & Fragrances, Inc. 6.00% Tangible Equity Units",n/a,n/a,n/a,n/a,n/a,n/a,n/a
1655,IFN,"India Fund, Inc. (The) Common Stock",n/a,n/a,n/a,n/a,n/a,n/a,n/a
1656,IFS,Intercorp Financial Services Inc. Common Shares,2.25,1,3,no,30.0,25.77,0.16399999999999998
1657,IGA,Voya Global Advantage and Premium Opportunity Fund Common Shares of Beneficial Interest,n/a,n/a,n/a,n/a,n/a,n/a,n/a
1658,IGC,India Globalization Capital Inc. Common Stock,n/a,n/a,n/a,n/a,n/a,n/a,n/a
1659,IGD,Voya Global Equity Dividend and Premium Opportunity Fund,n/a,n/a,n/a,n/a,n/a,n/a,n/a
1660,IGI,Western Asset Investment Grade Defined Opportunity Trust Inc. Common Stock,n/a,n/a,n/a,n/a,n/a,n/a,n/a
1661,IGR,CBRE Clarion Global Real Estate Income Fund Common Stock,n/a,n/a,n/a,n/a,n/a,n/a,n/a
1662,IGT,International Game Technology Ordinary Shares,2.86,6,1,no,35.5,26.45,0.342
1663,IGZ,IGZ (Listing Market NYSE Arca Network B F) Common Stock,n/a,n/a,n/a,n/a,n/a,n/a,n/a
1664,IHC,Independence Holding Company Common Stock,n/a,n/a,n/a,n/a,n/a,n/a,n/a
1665,IHD,Voya Emerging Markets High Income Dividend Equity Fund Common Shares,n/a,n/a,n/a,n/a,n/a,n/a,n/a
1666,IHG,Intercontinental Hotels Group American Depositary Shares (Each representing one Ordinary Share),n/a,n/a,n/a,n/a,n/a,n/a,n/a
1667,IHIT,Invesco High Income 2023 Target Term Fund Common Shares of Beneficial Interest,n/a,n/a,n/a,n/a,n/a,n/a,n/a
1668,IHT,InnSuites Hospitality Trust Shares of Beneficial Interest,n/a,n/a,n/a,n/a,n/a,n/a,n/a
1669,IHTA,"Invesco High Income 2024 Target Term Fund Common Shares of Beneficial Interest, No par value per share",n/a,n/a,n/a,n/a,n/a,n/a,n/a
1670,IID,Voya International High Dividend Equity Income Fund Common Shares of Beneficial Interest,n/a,n/a,n/a,n/a,n/a,n/a,n/a
1671,IIF,"Morgan Stanley India Investment Fund, Inc. Common Stock",n/a,n/a,n/a,n/a,n/a,n/a,n/a
1672,IIM,Invesco Value Municipal Income Trust Common Stock,n/a,n/a,n/a,n/a,n/a,n/a,n/a
1673,IIPR,"Innovative Industrial Properties, Inc. Common Stock",2.75,6,2,no,256.29,259.69,-0.013000000000000001
1674,IIPR$A,"Innovative Industrial Properties, Inc. 9.00% Series A Cumulative Redeemable Preferred Stock",n/a,n/a,n/a,n/a,n/a,n/a,n/a
1675,IMAX,Imax Corporation Common Stock,2.7,8,1,1,24.86,16.05,0.549
1676,IMH,"Impac Mortgage Holdings, Inc. Common Stock ",n/a,n/a,n/a,n/a,n/a,n/a,n/a
1677,IMLP,iPath S&P MLP ETN,n/a,n/a,n/a,n/a,n/a,n/a,n/a
1678,INDO,Indonesia Energy Corporation Limited Ordinary Shares,3.0,1,no,no,8.0,2.99,1.676
1679,INFO,IHS Markit Ltd. Common Shares,2.29,2,5,no,117.0,127.51,-0.08199999999999999
1680,INFU,"InfuSystems Holdings, Inc. Common Stock",3.0,2,no,no,26.5,16.5,0.606
1681,INFY,Infosys Limited American Depositary Shares,2.29,1,4,1,21.56,22.82,-0.055
1682,ING,"ING Group, N.V. Common Stock",2.38,7,4,2,13.01,13.91,-0.065
1683,INGR,Ingredion Incorporated Common Stock,2.75,3,1,no,109.25,93.89,0.16399999999999998
1684,INN,"Summit Hotel Properties, Inc. Common Stock",2.0,2,no,2,11.13,8.87,0.254
1685,INN$D,"Summit Hotel Properties, Inc. 6.45% Series D Cumulative Redeemable Preferred Stock",n/a,n/a,n/a,n/a,n/a,n/a,n/a
1686,INN$E,"Summit Hotel Properties, Inc. 6.250% Series E Cumulative Redeemable Preferred Stock",n/a,n/a,n/a,n/a,n/a,n/a,n/a
1687,INS,Intelligent Systems Corporation Common Stock,n/a,n/a,n/a,n/a,n/a,n/a,n/a
1688,INSI,Insight Select Income Fund,n/a,n/a,n/a,n/a,n/a,n/a,n/a
1689,INSP,"Inspire Medical Systems, Inc. Common Stock",3.0,3,no,no,23.0,15.76,0.459
1690,INSW,"International Seaways, Inc. Common Stock ",3.0,2,no,no,28.0,14.25,0.965
1691,INSW$A,"International Seaways, Inc. 8.50% Senior Notes due June 30, 2023",n/a,n/a,n/a,n/a,n/a,n/a,n/a
1692,INT,World Fuel Services Corporation Common Stock,1.5,no,1,1,32.5,25.27,0.28600000000000003
1693,INTT,inTest Corporation Common Stock,3.0,1,no,no,16.0,14.4,0.111
1694,INUV,"Inuvo, Inc.",3.0,1,no,no,3.0,0.61,3.902
1695,INVH,Invitation Homes Inc. Common Stock,2.93,11,2,no,45.81,41.34,0.10800000000000001
1696,IO,Ion Geophysical Corporation Common Stock,3.0,2,no,no,6.85,1.65,3.152
1697,IOR,"Income Opportunity Realty Investors, Inc. Common Stock",n/a,n/a,n/a,n/a,n/a,n/a,n/a
1698,IP,International Paper Company Common Stock,2.13,5,7,3,59.14,46.16,0.281
1699,IPG,"Interpublic Group of Companies, Inc. (The) Common Stock",2.5,4,4,no,37.78,34.22,0.10400000000000001
1700,IPHI,Inphi Corporation Common Stock $0.001 par value,2.43,3,4,no,183.29,172.27,0.064
1701,IPI,"Intrepid Potash, Inc Common Stock",2.5,1,1,no,36.0,41.3,-0.128
1702,IPOB,Social Capital Hedosophia Holdings Corp. II Class A Ordinary Shares,n/a,n/a,n/a,n/a,n/a,n/a,n/a
1703,IPOB.U,"Social Capital Hedosophia Holdings Corp. II Units, each consisting of one Class A ordinary share and one-quarter of one redeemable warrant",n/a,n/a,n/a,n/a,n/a,n/a,n/a
1704,IPOB.W,"Social Capital Hedosophia Holdings Corp. II Redeemable Warrants, each whole warrant exercisable for one Class A ordinary share at an exercise price of $11.50",n/a,n/a,n/a,n/a,n/a,n/a,n/a
1705,IPOC,Social Capital Hedosophia Holdings Corp. III Class A Ordinary Shares,n/a,n/a,n/a,n/a,n/a,n/a,n/a
1706,IPOC.U,"Social Capital Hedosophia Holdings Corp. III Units, each consisting of one Class A ordinary share and one-quarter of one redeemable warrant",n/a,n/a,n/a,n/a,n/a,n/a,n/a
1707,IPOC.W,"Social Capital Hedosophia Holdings Corp. III Redeemable Warrants, each whole warrant exercisable for one Class A ordinary share at an exercise price of $11.50",n/a,n/a,n/a,n/a,n/a,n/a,n/a
1708,IPV,InterPrivate Acquisition Corp. Common Stock,n/a,n/a,n/a,n/a,n/a,n/a,n/a
1709,IPV.U,"InterPrivate Acquisition Corp. Units, each consisting of one share of common stock, $.0001 par value, and one-half of one Warrant",n/a,n/a,n/a,n/a,n/a,n/a,n/a
1710,IPV.W,"InterPrivate Acquisition Corp. Redeemable Warrants, each whole warrant exercisable for shares of common stock at an exercise price of $11.50 per share",n/a,n/a,n/a,n/a,n/a,n/a,n/a
1711,IQI,Invesco Quality Municipal Income Trust Common Stock,n/a,n/a,n/a,n/a,n/a,n/a,n/a
1712,IQV,"IQVIA Holdings, Inc. Common Stock",2.94,17,1,no,280.17,262.81,0.066
1713,IR,Ingersoll Rand Inc. Common Stock,2.83,10,2,no,63.8,59.32,0.076
1714,IRET,Investors Real Estate Trust Shares of Beneficial Interest,n/a,n/a,n/a,n/a,n/a,n/a,n/a
1715,IRET$C,Investors Real Estate Trust 6.625% Series C Cumulative Redeemable Preferred Shares (Liquidation Preference $25.00 Per Share),n/a,n/a,n/a,n/a,n/a,n/a,n/a
1716,IRL,"New Ireland Fund, Inc (The) Common Stock",n/a,n/a,n/a,n/a,n/a,n/a,n/a
1717,IRM,Iron Mountain Incorporated (Delaware)Common Stock REIT,2.33,2,no,1,33.0,46.37,-0.28800000000000003
1718,IRR,Voya Natural Resources Equity Income Fund Common Shares of Beneficial Interest,n/a,n/a,n/a,n/a,n/a,n/a,n/a
1719,IRS,IRSA Inversiones Y Representaciones S.A. Common Stock,n/a,n/a,n/a,n/a,n/a,n/a,n/a
1720,IRT,"Independence Realty Trust, Inc. Common Stock",2.71,5,2,no,19.54,24.37,-0.198
1721,ISD,"PGIM High Yield Bond Fund, Inc.",n/a,n/a,n/a,n/a,n/a,n/a,n/a
1722,ISDR,Issuer Direct Corporation Common Stock,n/a,n/a,n/a,n/a,n/a,n/a,n/a
1723,ISR,"IsoRay, Inc. Common Stock (DE)",3.0,4,no,no,1.84,0.45,3.083
1724,IT,"Gartner, Inc. Common Stock",2.43,3,4,no,299.5,315.13,-0.05
1725,ITCB,"Itau CorpBanca American Depositary Shares (each representing 1,500 shares of Common Stock, no par value)",n/a,n/a,n/a,n/a,n/a,n/a,n/a
1726,ITGR,Integer Holdings Corporation Common Stock,3.0,2,no,no,108.0,82.75,0.305
1727,ITP,"IT Tech Packaging, Inc. Common Stock",n/a,n/a,n/a,n/a,n/a,n/a,n/a
1728,ITRG,Integra Resources Corp. Common Shares,3.0,5,no,no,6.92,2.18,2.173
1729,ITT,ITT Inc. Common Stock ,2.67,6,3,no,103.63,95.12,0.08900000000000001
1730,ITUB,Itau Unibanco Banco Holding SA American Depositary Shares (Each repstg 500 Preferred shares),n/a,n/a,n/a,n/a,n/a,n/a,n/a
1731,ITW,Illinois Tool Works Inc. Common Stock,2.13,4,9,2,232.36,234.81,-0.01
1732,IVC,Invacare Corporation Common Stock,3.0,2,no,no,8.5,2.55,2.333
1733,IVH,Ivy High Income Opportunities Fund Common Shares of Beneficial Interest,n/a,n/a,n/a,n/a,n/a,n/a,n/a
1734,IVR,INVESCO MORTGAGE CAPITAL INC Common Stock,1.0,no,no,1,2.75,3.0,-0.083
1735,IVR$A,Invesco Mortgage Capital Inc. Pfd Ser A,n/a,n/a,n/a,n/a,n/a,n/a,n/a
1736,IVR$B,Invesco Mortgage Capital Inc. Preferred Series B Cum Fxd to Fltg,n/a,n/a,n/a,n/a,n/a,n/a,n/a
1737,IVR$C,"INVESCO MORTGAGE CAPITAL INC 7.5% Fixed-to-Floating Series C Cumulative Redeemable Preferred Stock, Liquation Preference $25.00 per Share",n/a,n/a,n/a,n/a,n/a,n/a,n/a
1738,IVZ,Invesco Ltd Common Stock,2.13,3,3,2,28.5,22.6,0.261
1739,IX,Orix Corp Ads Common Stock,n/a,n/a,n/a,n/a,n/a,n/a,n/a
1740,J,Jacobs Engineering Group Inc. Common Stock,2.88,7,1,no,158.38,142.98,0.10800000000000001
1741,JAX,"J. Alexander's Holdings, Inc. Common Stock",n/a,n/a,n/a,n/a,n/a,n/a,n/a
1742,JBGS,JBG SMITH Properties Common Shares ,3.0,1,no,no,40.0,27.67,0.446
1743,JBK,Lehman ABS 3.50 3.50% Adjustable Corp Backed Tr Certs GS Cap I,n/a,n/a,n/a,n/a,n/a,n/a,n/a
1744,JBL,Jabil Inc. Common Stock,2.83,3,2,no,61.86,59.55,0.039
1745,JBT,John Bean Technologies Corporation Common Stock,2.8,4,1,no,149.25,158.92,-0.061
1746,JCAP,"Jernigan Capital, Inc. Common Stock",n/a,n/a,n/a,n/a,n/a,n/a,n/a
1747,JCAP$B,"Jernigan Capital, Inc. 7.00% Series B Cumulative Redeemable Perpetual Preferred Stock",n/a,n/a,n/a,n/a,n/a,n/a,n/a
1748,JCE,Nuveen Core Equity Alpha Fund Nuveen Core Equity Alpha Fund Common Shares of Beneficial Interest,n/a,n/a,n/a,n/a,n/a,n/a,n/a
1749,JCI,Johnson Controls International plc Ordinary Share,2.69,11,5,no,75.73,76.76,-0.013000000000000001
1750,JCO,Nuveen Credit Opportunities 2022 Target Term Fund Common Shares of Beneficial Interest,n/a,n/a,n/a,n/a,n/a,n/a,n/a
1751,JDD,Nuveen Diversified Dividend and Income Fund Shares of Beneficial Interest,n/a,n/a,n/a,n/a,n/a,n/a,n/a
1752,JE,"Just Energy Group, Inc. Ordinary Shares (Canada)",1.0,no,no,3,1.75,1.11,0.5770000000000001
1753,JE$A,"Just Energy Group, Inc. 8.50% Series A Fixed-to-Floating Rate Cumulative Redeemable Perpetual Preferred Shares",n/a,n/a,n/a,n/a,n/a,n/a,n/a
1754,JEF,Jefferies Financial Group Inc. Common Stock,2.67,2,1,no,44.0,38.38,0.146
1755,JELD,"JELD-WEN Holding, Inc. Common Stock",2.57,4,3,no,31.86,24.94,0.277
1756,JEMD,"Nuveen Emerging Markets Debt 2022 Target Term Fund Common Shares of Beneficial Interest, $0.01 par value per share",n/a,n/a,n/a,n/a,n/a,n/a,n/a
1757,JEQ,"Aberdeen Japan Equity Fund, Inc.  Common Stock",n/a,n/a,n/a,n/a,n/a,n/a,n/a
1758,JFR,Nuveen Floating Rate Income Fund Common Stock,n/a,n/a,n/a,n/a,n/a,n/a,n/a
1759,JGH,Nuveen Global High Income Fund Common Shares of Beneficial Interest,n/a,n/a,n/a,n/a,n/a,n/a,n/a
1760,JHAA,Nuveen Corporate Income 2023 Target Term Fund,n/a,n/a,n/a,n/a,n/a,n/a,n/a
1761,JHB,Nuveen Corporate Income November 2021 Target Term Fund,n/a,n/a,n/a,n/a,n/a,n/a,n/a
1762,JHG,Janus Henderson Group plc Ordinary Shares,1.75,no,3,1,44.63,42.19,0.057999999999999996
1763,JHI,John Hancock Investors Trust Common Stock,n/a,n/a,n/a,n/a,n/a,n/a,n/a
1764,JHS,John Hancock Income Securities Trust Common Stock,n/a,n/a,n/a,n/a,n/a,n/a,n/a
1765,JHX,James Hardie Industries plc American Depositary Shares (Ireland),n/a,n/a,n/a,n/a,n/a,n/a,n/a
1766,JHY,Nuveen High Income 2020 Target Term Fund Common Shares of Beneficial Interest,n/a,n/a,n/a,n/a,n/a,n/a,n/a
1767,JIH,"Juniper Industrial Holdings, Inc. Class A Common Stock",n/a,n/a,n/a,n/a,n/a,n/a,n/a
1768,JIH.U,"Juniper Industrial Holdings, Inc. Units, each consisting of one share of Class A common stock, $0.0001 par value per share, and one-half of one warrant",n/a,n/a,n/a,n/a,n/a,n/a,n/a
1769,JIH.W,"Juniper Industrial Holdings, Inc. Redeemable warrants included as part of the units",n/a,n/a,n/a,n/a,n/a,n/a,n/a
1770,JILL,"J. Jill, Inc. Common Stock",n/a,n/a,n/a,n/a,n/a,n/a,n/a
1771,JJA,iPathA Series B Bloomberg Agriculture Subindex Total Return ETN,n/a,n/a,n/a,n/a,n/a,n/a,n/a
1772,JJC,iPathA Series B Bloomberg Copper Subindex Total Return ETN,n/a,n/a,n/a,n/a,n/a,n/a,n/a
1773,JJE,iPathA Series B Bloomberg Energy Subindex Total Return ETN,n/a,n/a,n/a,n/a,n/a,n/a,n/a
1774,JJG,iPathA Series B Bloomberg Grains Subindex Total Return ETN,n/a,n/a,n/a,n/a,n/a,n/a,n/a
1775,JJM,iPathA Series B Bloomberg Industrial Metals Subindex Total Return ETN,n/a,n/a,n/a,n/a,n/a,n/a,n/a
1776,JJN,iPathA Series B Bloomberg Nickel Subindex Total Return ETN,n/a,n/a,n/a,n/a,n/a,n/a,n/a
1777,JJP,iPathA Series B Bloomberg Precious Metals Subindex Total Return ETN,n/a,n/a,n/a,n/a,n/a,n/a,n/a
1778,JJS,iPathA Series B Bloomberg Softs Subindex Total Return ETN,n/a,n/a,n/a,n/a,n/a,n/a,n/a
1779,JJT,iPathA Series B Bloomberg Tin Subindex Total Return ETN,n/a,n/a,n/a,n/a,n/a,n/a,n/a
1780,JJU,iPathA Series B Bloomberg Aluminum Subindex Total Return ETN,n/a,n/a,n/a,n/a,n/a,n/a,n/a
1781,JKS,JinkoSolar Holding Company Limited American Depositary Shares (each representing 4 Common Shares),2.0,1,3,1,39.67,52.84,-0.249
1782,JLL,Jones Lang LaSalle Incorporated Common Stock,3.0,4,no,no,236.0,239.22,-0.013000000000000001
1783,JLS,Nuveen Mortgage and Income Fund,n/a,n/a,n/a,n/a,n/a,n/a,n/a
1784,JMIA,"Jumia Technologies AG American Depositary Shares, each representing two Ordinary Shares",1.67,no,2,1,14.5,11.55,0.255
1785,JMM,Nuveen Multi-Market Income Fund (MA),n/a,n/a,n/a,n/a,n/a,n/a,n/a
1786,JMP,JMP Group LLC Common Shares,2.0,no,1,no,n/a,n/a,n/a
1787,JNJ,Johnson & Johnson Common Stock,2.75,6,2,no,189.75,159.37,0.19100000000000003
1788,JNPR,"Juniper Networks, Inc. Common Stock",2.44,5,3,1,29.78,31.57,-0.057
1789,JO,iPathA Series B Bloomberg Coffee Subindex Total Return ETN,n/a,n/a,n/a,n/a,n/a,n/a,n/a
1790,JOB,GEE Group Inc. Common Stock,n/a,n/a,n/a,n/a,n/a,n/a,n/a
1791,JOE,St. Joe Company (The) Common Stock,n/a,n/a,n/a,n/a,n/a,n/a,n/a
1792,JOF,Japan Smaller Capitalization Fund Inc Common Stock,n/a,n/a,n/a,n/a,n/a,n/a,n/a
1793,JP,"Jupai Holdings Limited American Depositary Shares, each representing six ordinary shares",n/a,n/a,n/a,n/a,n/a,n/a,n/a
1794,JPC,Nuveen Preferred & Income Opportunities Fund,n/a,n/a,n/a,n/a,n/a,n/a,n/a
1795,JPI,Nuveen Preferred and Income Term Fund Common Shares of Beneficial Interest,n/a,n/a,n/a,n/a,n/a,n/a,n/a
1796,JPM,JP Morgan Chase & Co. Common Stock,2.61,12,5,1,168.18,159.88,0.052000000000000005
1797,JPM$C,"J P Morgan Chase & Co Depositary Shares, each representing a 1/400th interest in a share of 6.00% Non-Cumulative  Preferred Stock, Series EE",n/a,n/a,n/a,n/a,n/a,n/a,n/a
1798,JPM$D,"J P Morgan Chase & Co Depositary Shares, each representing a 1/400th  interest in a share of 5.75% Non-Cumulative  Preferred Stock, Series DD",n/a,n/a,n/a,n/a,n/a,n/a,n/a
1799,JPM$G,"J P Morgan Chase & Co Depositary Shares, each representing a 1/400th interest in a share of 6.10% Non-Cumulative Preferred Stock, Series AA",n/a,n/a,n/a,n/a,n/a,n/a,n/a
1800,JPM$H,"J P Morgan Chase & Co Depositary Shares, each representing a 1/400th interest in a share of 6.15% Non-Cumulative Preferred Stock, Series BB",n/a,n/a,n/a,n/a,n/a,n/a,n/a
1801,JPM$J,"J P Morgan Chase & Co Depositary Shares, each representing a 1/400th interest in a share of JPMorgan Chase & Co. 4.75% Non-Cumulative Preferred Stock, Series GG",n/a,n/a,n/a,n/a,n/a,n/a,n/a
1802,JPS,Nuveen Preferred & Income Securities Fund,n/a,n/a,n/a,n/a,n/a,n/a,n/a
1803,JPT,Nuveen Preferred and Income 2022 Term Fund Common Shares of Beneficial Interest,n/a,n/a,n/a,n/a,n/a,n/a,n/a
1804,JQC,Nuveen Credit Strategies Income Fund Shares of Beneficial Interest,n/a,n/a,n/a,n/a,n/a,n/a,n/a
1805,JRI,Nuveen Real Asset Income and Growth Fund Common Shares of Beneficial Interest,n/a,n/a,n/a,n/a,n/a,n/a,n/a
1806,JRO,Nuveen Floating Rate Income Opportuntiy Fund Shares of Beneficial Interest,n/a,n/a,n/a,n/a,n/a,n/a,n/a
1807,JRS,Nuveen Real Estate Income Fund Common Shares of Beneficial Interest,n/a,n/a,n/a,n/a,n/a,n/a,n/a
1808,JSD,Nuveen Short Duration Credit Opportunities Fund Common Shares of Beneficial Interest,n/a,n/a,n/a,n/a,n/a,n/a,n/a
1809,JT,"Jianpu Technology Inc. American depositary shares, each two representing five Class A ordinary shares",n/a,n/a,n/a,n/a,n/a,n/a,n/a
1810,JTA,Nuveen Tax-Advantaged Total Return Strategy Fund Common Share of Beneficial Interest,n/a,n/a,n/a,n/a,n/a,n/a,n/a
1811,JTD,Nuveen Tax-Advantaged Dividend Growth Fund Common Shares of Beneficial Interest,n/a,n/a,n/a,n/a,n/a,n/a,n/a
1812,JW.A,"John Wiley & Sons, Inc. Common Stock",n/a,n/a,n/a,n/a,n/a,n/a,n/a
1813,JW.B,"John Wiley & Sons, Inc. Common Stock",n/a,n/a,n/a,n/a,n/a,n/a,n/a
1814,JWN,"Nordstrom, Inc. Common Stock",1.93,2,9,3,30.0,20.99,0.429
1815,JWS,Jaws Acquisition Corp. Class A Ordinary Shares,n/a,n/a,n/a,n/a,n/a,n/a,n/a
1816,JWS.U,"Jaws Acquisition Corp. Units, each consisting of one Class A ordinary share and one-third of one redeemable warrant",n/a,n/a,n/a,n/a,n/a,n/a,n/a
1817,JWS.W,"Jaws Acquisition Corp. Redeemable Warrants, each whole warrant exercisable for one Class A ordinary share at an exercise price of $11.50",n/a,n/a,n/a,n/a,n/a,n/a,n/a
1818,K,Kellogg Company Common Stock,2.4,4,6,no,66.56,61.67,0.079
1819,KAI,Kadant Inc Common Stock,2.5,1,1,no,192.5,233.8,-0.177
1820,KAMN,Kaman Corporation Common Stock,3.0,1,no,no,59.0,38.31,0.54
1821,KAR,"KAR Auction Services, Inc Common Stock",2.2,2,2,1,19.2,14.67,0.309
1822,KB,KB Financial Group Inc,n/a,n/a,n/a,n/a,n/a,n/a,n/a
1823,KBH,KB Home Common Stock,2.71,8,5,no,51.73,40.51,0.277
1824,KBR,"KBR, Inc. Common Stock",2.8,4,1,no,41.63,42.7,-0.025
1825,KCAC,Kensington Capital Acquisition Corp. Class A Common Stock,n/a,n/a,n/a,n/a,n/a,n/a,n/a
