,symbol,company_name,score,buy,hold,sell,price_target,current,upside
2629,PSA$K,"Public Storage Depositary Shares Each Representing 1/1,000 of a 4.75% Cumulative Preferred Share of Beneficial Interest, Series K",n/a,n/a,n/a,n/a,n/a,n/a,n/a
2630,PSA$L,"Public Storage Depositary Shares Each Representing 1/1,000 of a 4.625% Cumulative Preferred Share of Beneficial Interest, Series L, par value $0.01 per share",n/a,n/a,n/a,n/a,n/a,n/a,n/a
2631,PSA$M,"Public Storage Depositary Shares Each Representing 1/1,000 of a 4.125% Cumulative Preferred Share of Beneficial Interest, Series M",n/a,n/a,n/a,n/a,n/a,n/a,n/a
2632,PSA$W,Public Storage Depositary Shares Representing 1/1000 Preferred Shares of Benficial Interest Series W,n/a,n/a,n/a,n/a,n/a,n/a,n/a
2633,PSA$X,Public Storage Depositary Shares Representing 1/1000th Cumulative Preferred Shares Beneficial Interest Series X,n/a,n/a,n/a,n/a,n/a,n/a,n/a
2634,PSB,"PS Business Parks, Inc. Common Stock",2.33,1,2,no,182.5,179.04,0.019
2635,PSB$W,"PS Business Parks, Inc. Depositary Shares Each Representing 1/1000 of a Share of 5.20% Cumulative Preferred Stock, Series W",n/a,n/a,n/a,n/a,n/a,n/a,n/a
2636,PSB$X,"PS Business Parks, Inc. Depositary Shares Each Representing 1/1,000 of a Share of 5.25% Cumulative Preferred Stock, Series X",n/a,n/a,n/a,n/a,n/a,n/a,n/a
2637,PSB$Y,"PS Business Parks, Inc. 5.20% Cumulative Preferred Stock, Series Y",n/a,n/a,n/a,n/a,n/a,n/a,n/a
2638,PSB$Z,"PS Business Parks, Inc. Depositary Shares Each Representing 1/1000 of a Share of 4.875% Cumulative Preferred Stock, Series Z , par value $0.01 per share",n/a,n/a,n/a,n/a,n/a,n/a,n/a
2639,PSF,"Cohen & Steers Select Preferred and Income Fund, Inc. Common Stock",n/a,n/a,n/a,n/a,n/a,n/a,n/a
2640,PSN,Parsons Corporation Common Stock,1.8,no,4,1,43.6,33.46,0.303
2641,PSO,"Pearson, Plc Common Stock",n/a,n/a,n/a,n/a,n/a,n/a,n/a
2642,PSTG,"Pure Storage, Inc. Class A Common Stock",2.9,16,3,no,32.6,31.2,0.045
2643,PSTH.U,"Pershing Square Tontine Holdings, Ltd. Units, each consisting of one share of Class A Common Stock and one-ninth of one Warrant to purchase one share of Class A Common Stock",n/a,n/a,n/a,n/a,n/a,n/a,n/a
2644,PSTL,"Postal Realty Trust, Inc. Class A Common Stock",3.0,1,no,no,22.0,17.41,0.264
2645,PSV,Hermitage Offshore Services Ltd. Ordinary Shares (Bermuda),n/a,n/a,n/a,n/a,n/a,n/a,n/a
2646,PSX,Phillips 66 Common Stock,2.71,8,5,no,86.92,70.73,0.22899999999999998
2647,PSXP,Phillips 66 Partners LP Common Units representing limited partner interest in the Partnership,2.0,no,7,no,38.17,34.99,0.091
2648,PTK.U,PTK Acquisition Corp. Units,n/a,n/a,n/a,n/a,n/a,n/a,n/a
2649,PTN,"Palatin Technologies, Inc. Common Stock",3.0,3,no,no,3.33,0.61,4.444
2650,PTR,PetroChina Company Limited Common Stock,2.67,2,3,no,36.18,43.99,-0.17800000000000002
2651,PTY,Pimco Corporate & Income Opportunity Fund,n/a,n/a,n/a,n/a,n/a,n/a,n/a
2652,PUK,Prudential Public Limited Company Common Stock,n/a,n/a,n/a,n/a,n/a,n/a,n/a
2653,PUK$,Prudential Public Limited Company 6.75% Perpetual Subordinated Captial Security,n/a,n/a,n/a,n/a,n/a,n/a,n/a
2654,PUK$A,Prudential Public Limited Company 6.50% Perpetual Subordinated Capital Securities Exchangeable at the Issuer's Option Into Non-Cumulative Dollar Denominated Preference Shares,n/a,n/a,n/a,n/a,n/a,n/a,n/a
2655,PUMP,ProPetro Holding Corp. Common Stock,2.43,4,2,1,11.13,8.15,0.365
2656,PVG,"Pretium Resources, Inc. Ordinary Shares (Canada)",2.5,3,3,no,17.25,13.48,0.28
2657,PVH,PVH Corp. Common Stock,2.61,11,7,no,120.61,106.32,0.134
2658,PVL,Permianville Royalty Trust Trust Units ,n/a,n/a,n/a,n/a,n/a,n/a,n/a
2659,PW,Power REIT (MD) Common Stock,3.0,1,no,no,86.0,51.66,0.665
2660,PW$A,Power REIT 7.75% Series A Cumulative Perpetual Preferred Stock,n/a,n/a,n/a,n/a,n/a,n/a,n/a
2661,PWR,"Quanta Services, Inc. Common Stock",2.73,8,3,no,131.8,113.25,0.16399999999999998
2662,PXD,Pioneer Natural Resources Company Common Stock,2.86,14,5,no,211.11,178.07,0.18600000000000003
2663,PYN,PIMCO New York Municipal Income Fund III Common Shares of Beneficial Interest,n/a,n/a,n/a,n/a,n/a,n/a,n/a
2664,PYPE,"ETRACS NYSE Pickens Core Midstream Index ETN due August 20, 2048",n/a,n/a,n/a,n/a,n/a,n/a,n/a
2665,PYS,Merrill Lynch Depositor Inc PPlus Tr Ser RRD-1 Tr Ctf Cl A,n/a,n/a,n/a,n/a,n/a,n/a,n/a
2666,PYT,PPlus Tr GSC-2 Tr Ctf Fltg Rate,n/a,n/a,n/a,n/a,n/a,n/a,n/a
2667,PZC,PIMCO California Municipal Income Fund III Common Shares of Beneficial Interest,n/a,n/a,n/a,n/a,n/a,n/a,n/a
2668,PZG,Paramount Gold Nevada Corp. Common Stock,3.0,2,no,no,2.33,0.72,2.245
2669,PZN,Pzena Investment Management Inc Class A Common Stock,n/a,n/a,n/a,n/a,n/a,n/a,n/a
2670,QD,"Qudian Inc. American Depositary Shares, each representing one Class A Ordinary Share",n/a,n/a,n/a,n/a,n/a,n/a,n/a
2671,QEP,"QEP Resources, Inc. Common Stock",2.33,1,2,no,2.2,4.08,-0.461
2672,QGEN,Qiagen N.V. Common Shares ,2.58,7,5,no,52.13,54.37,-0.040999999999999995
2673,QSR,Restaurant Brands International Inc. Common Shares,2.48,11,9,1,70.62,55.16,0.28
2674,QTS,"QTS Realty Trust, Inc. Class A Common Stock",2.5,4,7,no,75.67,77.98,-0.03
2675,QTS$A,"QTS Realty Trust, Inc. 7.125% Series A Cumulative Redeemable Perpetual Preferred Stock",n/a,n/a,n/a,n/a,n/a,n/a,n/a
2676,QTS$B,"QTS Realty Trust, Inc. 6.50% Series B Cumulative Convertible Perpetual Preferred Stock",n/a,n/a,n/a,n/a,n/a,n/a,n/a
2677,QTWO,"Q2 Holdings, Inc. Common Stock",2.89,8,1,no,126.0,77.19,0.632
2678,QUAD,"Quad Graphics, Inc Class A Common Stock",n/a,n/a,n/a,n/a,n/a,n/a,n/a
2679,QUOT,Quotient Technology Inc. Common Stock,2.5,3,no,1,12.75,7.11,0.793
2680,QVCC,"QVC, Inc. 6.250% Senior Secured Notes due 2068",n/a,n/a,n/a,n/a,n/a,n/a,n/a
2681,QVCD,"QVC, Inc. 6.375% Senior Secured Notes due 2067",n/a,n/a,n/a,n/a,n/a,n/a,n/a
2682,R,"Ryder System, Inc. Common Stock",2.56,5,4,no,90.13,80.94,0.113
2683,RA,Brookfield Real Assets Income Fund Inc. Common Stock,n/a,n/a,n/a,n/a,n/a,n/a,n/a
2684,RACE,Ferrari N.V. Common Shares,2.35,8,7,2,252.8,260.82,-0.031000000000000003
2685,RAD,Rite Aid Corporation Common Stock,1.33,no,1,2,12.67,11.84,0.07
2686,RAMP,"LiveRamp Holdings, Inc. Common Stock",2.89,8,1,no,80.44,44.34,0.8140000000000001
2687,RBA,Ritchie Bros. Auctioneers Incorporated Common Stock,1.7,no,7,3,65.67,68.14,-0.036000000000000004
2688,RBAC.U,"RedBall Acquisition Corp. Units, each consisting of one Class A ordinary share and one-third of one redeemable warrant",n/a,n/a,n/a,n/a,n/a,n/a,n/a
2689,RBC,Regal Beloit Corporation Common Stock,3.0,4,no,no,81.38,158.1,-0.485
2690,RC,Ready Capital Corproation Common Stock,2.83,5,1,no,17.0,15.35,0.107
2691,RCA,Ready Capital Corporation 7.00% Convertible Senior Notes due 2023,n/a,n/a,n/a,n/a,n/a,n/a,n/a
2692,RCB,Ready Capital Corporation 6.20% Senior Notes due 2026,n/a,n/a,n/a,n/a,n/a,n/a,n/a
2693,RCG,"RENN Fund, Inc Common Stock",n/a,n/a,n/a,n/a,n/a,n/a,n/a
2694,RCI,"Rogers Communication, Inc. Common Stock",2.67,6,3,no,71.13,45.27,0.5710000000000001
2695,RCL,D/B/A Royal Caribbean Cruises Ltd. Common Stock,2.33,6,4,2,93.45,67.36,0.387
2696,RCP,Ready Capital Corporation 6.50% Senior Notes due 2021,n/a,n/a,n/a,n/a,n/a,n/a,n/a
2697,RCS,"PIMCO Strategic Income Fund, Inc.",n/a,n/a,n/a,n/a,n/a,n/a,n/a
2698,RCUS,"Arcus Biosciences, Inc. Common Stock",3.0,7,no,no,64.25,44.74,0.436
2699,RDN,Radian Group Inc. Common Stock,2.25,2,1,1,26.88,20.89,0.287
2700,RDS.A,Royal Dutch Shell PLC Royal Dutch Shell American Depositary Shares (Each representing two Class A Ordinary Shares),2.91,21,2,no,54.37,42.04,0.29300000000000004
2701,RDS.B,Royal Dutch Shell PLC Royal Dutch Shell PLC American Depositary Shares (Each representing two Class B Ordinary Shares),2.8,4,1,no,76.0,42.06,0.807
2702,RDY,Dr. Reddy's Laboratories Ltd Common Stock,2.67,2,1,no,71.71,61.68,0.163
2703,RE,"Everest Re Group, Ltd. Common Stock",2.83,5,1,no,308.83,259.99,0.188
2704,REI,"Ring Energy, Inc. Common Stock",2.67,2,1,no,4.38,2.31,0.8940000000000001
2705,RELX,RELX PLC PLC American Depositary Shares (Each representing One Ordinary Share),n/a,n/a,n/a,n/a,n/a,n/a,n/a
2706,REML,"Credit Suisse AG Credit Suisse X-Links Monthly Pay 2xLeveraged Mortgage REIT Exchange Traded Notes (ETNs) due July 11, 2036",n/a,n/a,n/a,n/a,n/a,n/a,n/a
2707,RENN,"Renren Inc. American Depositary Shares, each representing fifteen Class A ordinary shares",n/a,n/a,n/a,n/a,n/a,n/a,n/a
2708,RES,"RPC, Inc. Common Stock",1.67,no,2,1,3.44,3.96,-0.132
2709,RESI,Front Yard Residential Corporation Common Stock,n/a,n/a,n/a,n/a,n/a,n/a,n/a
2710,REV,"Revlon, Inc. New Common Stock",n/a,n/a,n/a,n/a,n/a,n/a,n/a
2711,REVG,"REV Group, Inc. Common Stock",2.0,1,3,1,16.0,16.12,-0.006999999999999999
2712,REX,REX American Resources Corporation,n/a,n/a,n/a,n/a,n/a,n/a,n/a
2713,REXR,"Rexford Industrial Realty, Inc. Common Stock",2.67,2,1,no,71.0,71.29,-0.004
2714,REXR$A,"Rexford Industrial Realty, Inc. 5.875% Series A Cumulative Redeemable Preferred Stock",n/a,n/a,n/a,n/a,n/a,n/a,n/a
2715,REXR$B,"Rexford Industrial Realty, Inc. 5.875% Series B Cumulative Redeemable Preferred Stock",n/a,n/a,n/a,n/a,n/a,n/a,n/a
2716,REXR$C,"Rexford Industrial Realty, Inc. 5.625% Series C Cumulative Redeemable Preferred Stock, par value $0.01 per share",n/a,n/a,n/a,n/a,n/a,n/a,n/a
2717,REZI,"Resideo Technologies, Inc. Common Stock ",2.33,2,4,no,28.5,26.79,0.064
2718,RF,Regions Financial Corporation Common Stock,2.37,9,8,2,21.92,22.88,-0.042
2719,RF$A,Regions Financial Corporation Depositary Shares Representing 1/40th Perpetual Preferred Series A,n/a,n/a,n/a,n/a,n/a,n/a,n/a
2720,RF$B,Regions Financial Corporation Depositary Shares Representing 1/40th Perpetual Preferred Series B,n/a,n/a,n/a,n/a,n/a,n/a,n/a
2721,RF$C,"Regions Financial Corporation Depositary Shares, each Representing a 1/40th Interest in a  Share of 5.700% Fixed-to-Floating Rate Non-Cumulative  Perpetual Preferred Stock, Series C",n/a,n/a,n/a,n/a,n/a,n/a,n/a
2722,RFI,"Cohen & Steers Total Return Realty Fund, Inc. Common Stock",n/a,n/a,n/a,n/a,n/a,n/a,n/a
2723,RFL,"Rafael Holdings, Inc. Class B Common Stock",n/a,n/a,n/a,n/a,n/a,n/a,n/a
2724,RFM,"RiverNorth Flexible Municipal Income Fund, Inc. Common Stock",n/a,n/a,n/a,n/a,n/a,n/a,n/a
2725,RFP,Resolute Forest Products Inc. Common Stock,2.5,2,2,no,15.0,11.44,0.311
2726,RGA,"Reinsurance Group of America, Incorporated Common Stock",2.17,3,1,2,125.71,96.37,0.304
2727,RGR,"Sturm, Ruger & Company, Inc. Common Stock",3.0,1,no,no,100.0,72.16,0.386
2728,RGS,Regis Corporation Common Stock,2.5,1,1,no,8.0,2.44,2.279
2729,RGT,"Royce Global Value Trust, Inc. Common Stock",n/a,n/a,n/a,n/a,n/a,n/a,n/a
2730,RH,RH Common Stock,2.71,10,4,no,732.69,579.01,0.265
2731,RHE,"Regional Health Properties, Inc. Common Stock",n/a,n/a,n/a,n/a,n/a,n/a,n/a
2732,RHE$A,"Regional Health Properties, Inc. 10.875% Series A Cumulative Redeemable Preferred Stock",n/a,n/a,n/a,n/a,n/a,n/a,n/a
2733,RHI,Robert Half International Inc. Common Stock,2.14,3,2,2,101.17,110.21,-0.08199999999999999
2734,RHP,"Ryman Hospitality Properties, Inc. (REIT)",3.0,3,no,no,78.5,77.57,0.012
2735,RIG,Transocean Ltd (Switzerland) Common Stock,1.5,no,3,3,3.2,3.03,0.055999999999999994
2736,RIO,Rio Tinto Plc Common Stock,2.33,8,8,2,100.8,63.47,0.588
2737,RIV,"RiverNorth Opportunities Fund, Inc. Common Stock",n/a,n/a,n/a,n/a,2.5,16.9,-0.8520000000000001
2738,RJA,AB Svensk Ekportkredit (Swedish Export Credit Corporation) ELEMENTS Linked to the Rogers International Commodity Index - Agriculture Total Return Structured Product,n/a,n/a,n/a,n/a,n/a,n/a,n/a
2739,RJF,"Raymond James Financial, Inc. Common Stock",2.89,8,1,no,95.22,97.27,-0.021
2740,RJI,AB Svensk Ekportkredit (Swedish Export Credit Corporation) ELEMENTS Linked to the Rogers International Commodity Index - Total Return Structured Product,n/a,n/a,n/a,n/a,n/a,n/a,n/a
2741,RJN,AB Svensk Ekportkredit (Swedish Export Credit Corporation) ELEMENTS Linked to the Rogers International Commodity Index - Energy Total Return Structured Product,n/a,n/a,n/a,n/a,n/a,n/a,n/a
2742,RJZ,AB Svensk Ekportkredit (Swedish Export Credit Corporation) ELEMENTS Linked to the Rogers International Commodity Index - Metals Total Return Structured Product,n/a,n/a,n/a,n/a,n/a,n/a,n/a
2743,RKT,"Rocket Companies, Inc. Class A Common Stock",1.85,1,9,3,18.79,15.69,0.198
2744,RL,Ralph Lauren Corporation Common Stock,2.73,11,4,no,133.29,118.48,0.125
2745,RLGT,"Radiant Logistics, Inc. Common Stock",3.0,1,no,no,10.0,7.66,0.305
2746,RLGY,Realogy Holdings Corp. Common Stock,2.4,3,1,1,21.5,15.33,0.402
2747,RLH,Red Lions Hotels Corporation Common Stock,n/a,n/a,n/a,n/a,n/a,n/a,n/a
2748,RLI,RLI Corp. Common Stock (DE),2.5,2,2,no,115.0,104.23,0.10300000000000001
2749,RLJ,RLJ Lodging Trust Common Shares of Beneficial Interest $0.01 par value,3.0,5,no,no,18.75,12.5,0.5
2750,RLJ$A,RLJ Lodging Trust $1.95 Series A Cumulative Convertible  Preferred Shares,n/a,n/a,n/a,n/a,n/a,n/a,n/a
2751,RM,Regional Management Corp. Common Stock,2.0,no,2,no,46.5,55.38,-0.16
2752,RMAX,"RE/MAX Holdings, Inc. Class A Common Stock",2.25,1,3,no,38.63,27.59,0.4
2753,RMD,ResMed Inc. Common Stock,2.1,3,5,2,244.43,257.73,-0.052000000000000005
2754,RMED,"Ra Medical Systems, Inc. Common Stock",2.5,1,1,no,12.0,2.2,4.455
2755,RMG.U,RMG Acquisition Corp. Unit,n/a,n/a,n/a,n/a,n/a,n/a,n/a
2756,RMG.W,"RMG Acquisition Corp. Warrants, each whole warrant exercisable for one share of Class A Common Stock at an exercise price of $11.50",n/a,n/a,n/a,n/a,n/a,n/a,n/a
2757,RMI,"RiverNorth Opportunistic Municipal Income Fund, Inc. Common Stock",n/a,n/a,n/a,n/a,n/a,n/a,n/a
2758,RMM,"RiverNorth Managed Duration Municipal Income Fund, Inc. Common Stock",n/a,n/a,n/a,n/a,n/a,n/a,n/a
2759,RMPL$,RiverNorth Specialty Finance Corporation 5.875% ,n/a,n/a,n/a,n/a,n/a,n/a,n/a
2760,RMT,"Royce Micro-Cap Trust, Inc. Common Stock",n/a,n/a,n/a,n/a,n/a,n/a,n/a
2761,RNG,"RingCentral, Inc. Class A Common Stock",2.94,15,2,no,407.75,203.93,0.9990000000000001
2762,RNGR,"Ranger Energy Services, Inc. Class A Common Stock",2.75,3,1,no,10.38,10.0,0.038
2763,RNP,"Cohen & Steers REIT and Preferred and Income Fund, Inc. Common Shares",n/a,n/a,n/a,n/a,n/a,n/a,n/a
2764,RNR,RenaissanceRe Holdings Ltd. Common Stock,2.5,4,1,1,193.83,158.29,0.225
2765,RNR$E,RenaissanceRe Holdings Ltd. 5.375% Series E Preference Shares,n/a,n/a,n/a,n/a,n/a,n/a,n/a
2766,RNR$F,"RenaissanceRe Holdings Ltd. Depositary Shares, each Representing a 1/1,000th Interest in a 5.750% Series F Preference Share",n/a,n/a,n/a,n/a,n/a,n/a,n/a
2767,RODI,iPath Return on Disability ETN,n/a,n/a,n/a,n/a,n/a,n/a,n/a
2768,ROG,Rogers Corporation Common Stock,2.0,no,4,no,264.67,271.9,-0.027000000000000003
2769,ROK,"Rockwell Automation, Inc. Common Stock",2.15,4,7,2,308.77,341.66,-0.096
2770,ROL,"Rollins, Inc. Common Stock",n/a,n/a,n/a,n/a,n/a,n/a,n/a
2771,ROP,"Roper Technologies, Inc. Common Stock",2.88,6,no,1,511.2,468.17,0.092
2772,RPAI,"Retail Properties of America, Inc. Class A Common Stock",2.0,no,3,no,11.75,13.15,-0.106
2773,RPLA,Replay Acquisition Corp. Ordinary Shares,n/a,n/a,n/a,n/a,n/a,n/a,n/a
2774,RPLA.U,"Replay Acquisition Corp. Units, each consisting of one Ordinary Share and one-half of one Warrant",n/a,n/a,n/a,n/a,n/a,n/a,n/a
2775,RPLA.W,"Replay Acquisition Corp. Warrants, each whole warrant exercisable for one Ordinary Share at an exercise price of $11.50",n/a,n/a,n/a,n/a,n/a,n/a,n/a
2776,RPM,RPM International Inc. Common Stock,2.14,2,4,1,92.6,91.91,0.008
2777,RPT,RPT Realty Common Stock,2.71,5,2,no,13.67,12.72,0.07400000000000001
2778,RPT$D,RPT Realty 7.25% ,n/a,n/a,n/a,n/a,n/a,n/a,n/a
2779,RQI,Cohen & Steers Quality Income Realty Fund Inc Common Shares,n/a,n/a,n/a,n/a,n/a,n/a,n/a
2780,RRC,Range Resources Corporation Common Stock,2.25,8,9,3,20.87,18.77,0.11199999999999999
2781,RRD,R.R. Donnelley & Sons Company Common Stock,n/a,n/a,n/a,n/a,n/a,n/a,n/a
2782,RS,Reliance Steel & Aluminum Co. Common Stock (DE),2.63,6,1,1,177.71,152.51,0.165
2783,RSF,RiverNorth Specialty Finance Corporation,n/a,n/a,n/a,n/a,n/a,n/a,n/a
2784,RSG,"Republic Services, Inc. Common Stock",2.7,5,4,no,124.56,135.07,-0.078
2785,RST,"Rosetta Stone Rosetta Stone, Inc.",n/a,n/a,n/a,n/a,n/a,n/a,n/a
2786,RTX,Raytheon Technologies Corporation Common Stock,2.86,12,2,no,99.42,80.53,0.23500000000000001
2787,RVI,Retail Value Inc. Common Stock ,3.0,1,no,no,27.0,6.15,3.39
2788,RVLV,"Revolve Group, Inc. Class A Common Stock",2.82,14,3,no,73.52,70.56,0.042
2789,RVP,"Retractable Technologies, Inc. Common Stock",n/a,n/a,n/a,n/a,n/a,n/a,n/a
2790,RVT,"Royce Value Trust, Inc. Common Stock",n/a,n/a,n/a,n/a,n/a,n/a,n/a
2791,RWT,"Redwood Trust, Inc. Common Stock",3.0,6,1,no,13.56,12.73,0.065
2792,RY,Royal Bank Of Canada Common Stock,2.64,8,2,1,135.98,98.56,0.38
2793,RY$T,"Royal Bank Of Canada 6.750% Fixed Rate/Floating Rate Noncumulative First Preferred Shares, Series C-2",n/a,n/a,n/a,n/a,n/a,n/a,n/a
2794,RYAM,Rayonier Advanced Materials Inc. Common Stock,3.0,1,no,no,10.0,5.45,0.835
2795,RYB,"RYB Education, Inc. American depositary shares, each representing one Class A ordinary share",n/a,n/a,n/a,n/a,n/a,n/a,n/a
2796,RYI,Ryerson Holding Corporation Common Stock,2.0,no,1,no,14.5,23.37,-0.38
2797,RYN,Rayonier Inc. REIT Common Stock,2.0,no,3,no,36.0,37.33,-0.036000000000000004
2798,RZA,"Reinsurance Group of America, Incorporated 6.20% Fixed-to-Floating Rate Subordinated Debentures due 2042",n/a,n/a,n/a,n/a,n/a,n/a,n/a
2799,RZB,"Reinsurance Group of America, Incorporated 5.75% Fixed-To-Floating Rate Subordinated Debentures due 2056",n/a,n/a,n/a,n/a,n/a,n/a,n/a
2800,SA,"Seabridge Gold, Inc. Ordinary Shares (Canada)",3.0,2,no,no,68.0,19.26,2.531
2801,SACC,Sachem Capital Corp. 6.875% Notes due 2024,n/a,n/a,n/a,n/a,n/a,n/a,n/a
2802,SACH,Sachem Capital Corp. Common Shares,3.0,2,no,no,8.0,5.84,0.37
2803,SAFE,Safehold Inc. Common Stock,2.6,3,2,no,85.21,71.58,0.19
2804,SAH,"Sonic Automotive, Inc. Common Stock",2.0,1,no,1,47.5,44.97,0.055999999999999994
2805,SAIC,SCIENCE APPLICATIONS INTERNATIONAL CORPORATION Common Stock,2.38,4,3,1,95.0,83.83,0.133
2806,SAIL,"SailPoint Technologies Holdings, Inc. Common Stock",2.91,10,1,no,66.54,50.02,0.33
2807,SAK,Saratoga Investment Corp 7.25% Notes due 2025,n/a,n/a,n/a,n/a,n/a,n/a,n/a
2808,SALT,Scorpio Bulkers Inc. Common Stock,2.0,no,2,no,18.0,8.44,1.133
2809,SAM,"Boston Beer Company, Inc. (The) Common Stock",2.38,7,4,2,770.92,447.2,0.7240000000000001
2810,SAN,"Banco Santander, S.A. Sponsored ADR (Spain)",2.58,7,5,no,3.43,3.14,0.09300000000000001
2811,SAN$B,"Banco Santander, S.A. Floating Rate Non-cumulative Series 6 Guaranteed Preferred Securities",n/a,n/a,n/a,n/a,n/a,n/a,n/a
2812,SAND,Sandstorm Gold Ltd. Ordinary Shares (Canada),2.5,6,3,1,11.58,6.1,0.899
2813,SAP,SAP  SE ADS,2.62,8,5,no,111.0,130.92,-0.152
2814,SAR,Saratoga Investment Corp New,3.0,7,no,no,29.17,29.1,0.002
2815,SAVE,"Spirit Airlines, Inc. Common Stock",2.33,6,8,1,34.0,20.74,0.639
2816,SB,"Safe Bulkers, Inc Common Stock ($0.001 par value)",2.67,2,1,no,4.33,3.46,0.252
2817,SB$C,"Safe Bulkers, Inc Cumulative Redeemable Perpetual Preferred Series C (Marshall Islands)",n/a,n/a,n/a,n/a,n/a,n/a,n/a
2818,SB$D,"Safe Bulkers, Inc Perpetual Preferred Series D (Marshall Islands)",n/a,n/a,n/a,n/a,n/a,n/a,n/a
2819,SBBA,Scorpio Tankers Inc. 7.00% Senior Notes due 2025,n/a,n/a,n/a,n/a,n/a,n/a,n/a
2820,SBE,Switchback Energy Acquisition Corporation Class A Common Stock,n/a,n/a,n/a,n/a,n/a,n/a,n/a
2821,SBE.U,Switchback Energy Acquisition Corporation Units,n/a,n/a,n/a,n/a,n/a,n/a,n/a
2822,SBE.W,Switchback Energy Acquisition Corporation Warrant,n/a,n/a,n/a,n/a,n/a,n/a,n/a
2823,SBH,"Sally Beauty Holdings, Inc. (Name to be changed from Sally Holdings, Inc.) Common Stock",2.4,2,3,no,24.25,19.27,0.258
2824,SBI,Western Asset Intermediate Muni Fund Inc Common Stock,n/a,n/a,n/a,n/a,n/a,n/a,n/a
2825,SBOW,"SilverBow Resorces, Inc. Common Stock",3.0,3,no,no,40.0,23.16,0.7270000000000001
2826,SBR,Sabine Royalty Trust Common Stock,n/a,n/a,n/a,n/a,n/a,n/a,n/a
2827,SBS,Companhia de saneamento Basico Do Estado De Sao Paulo - Sabesp American Depositary Shares (Each repstg 250 Common Shares),n/a,n/a,n/a,n/a,n/a,n/a,n/a
2828,SBSW,D/B/A Sibanye-Stillwater Limited ADS,3.0,2,no,no,23.5,12.67,0.855
2829,SC,Santander Consumer USA Holdings Inc. Common Stock,2.08,2,9,1,36.96,41.86,-0.11699999999999999
2830,SCA,Stellus Capital Investment Corporation 5.75% Notes due 2022,n/a,n/a,n/a,n/a,n/a,n/a,n/a
2831,SCCB,Sachem Capital Corp. 7.125% Notes due 2024,n/a,n/a,n/a,n/a,n/a,n/a,n/a
2832,SCCO,Southern Copper Corporation Common Stock,1.8,no,4,1,64.1,58.58,0.094
2833,SCD,LMP Capital and Income Fund Inc. Common Stock,n/a,n/a,n/a,n/a,n/a,n/a,n/a
2834,SCE$B,Southern California Edison Company 4.08% Preferred Stock,n/a,n/a,n/a,n/a,n/a,n/a,n/a
2835,SCE$C,Southern California Edison Company 4.24% Preferred Stock,n/a,n/a,n/a,n/a,n/a,n/a,n/a
2836,SCE$D,Southern California Edison Company 4.32% Preferred Stock,n/a,n/a,n/a,n/a,n/a,n/a,n/a
2837,SCE$E,Southern California Edison Company 4.78% Preferred Stock,n/a,n/a,n/a,n/a,n/a,n/a,n/a
2838,SCE$G,SCE Trust II Trust Preferred Securities,n/a,n/a,n/a,n/a,n/a,n/a,n/a
2839,SCE$H,SCE Trust III Fixed/Floating Rate Trust Preference Securities,n/a,n/a,n/a,n/a,n/a,n/a,n/a
2840,SCE$J,Southern California Edison Company 5.375% Fixed-to-Floating Rate Trust Preference Securities,n/a,n/a,n/a,n/a,n/a,n/a,n/a
2841,SCE$K,Southern California Edison Company 5.45% Fixed-to-Floating Rate Trust Preference Securities,n/a,n/a,n/a,n/a,n/a,n/a,n/a
2842,SCE$L,SCE TRUST VI,n/a,n/a,n/a,n/a,n/a,n/a,n/a
2843,SCHW,Charles Schwab Corporation (The) Common Stock,2.86,12,2,no,87.47,78.79,0.11
2844,SCHW$C,"The Charles Schwab Corporation Depositary Shares each representing 1/40th interest in a share of 6% Non-Cumulative Perpetual Preferred Stock, Series C",n/a,n/a,n/a,n/a,n/a,n/a,n/a
2845,SCHW$D,"The Charles Schwab Corporation Depositary Shares each representing 1/40th interest in a share of 5.95% Non-Cumulative Perpetual Preferred Stock, Series D",n/a,n/a,n/a,n/a,n/a,n/a,n/a
2846,SCI,Service Corporation International Common Stock,3.0,3,no,no,74.0,67.02,0.10400000000000001
2847,SCL,Stepan Company Common Stock,n/a,n/a,n/a,n/a,n/a,n/a,n/a
2848,SCM,Stellus Capital Investment Corporation Common Stock,3.0,2,no,no,15.25,13.5,0.13
2849,SCPE,SC Health Corporation Class A Ordinary Shares,3.0,1,no,no,20.0,15.84,0.263
2850,SCPE.U,SC Health Corporation Units,n/a,n/a,n/a,n/a,n/a,n/a,n/a
2851,SCPE.W,SC Health Corporation Warrants,n/a,n/a,n/a,n/a,n/a,n/a,n/a
2852,SCS,Steelcase Inc. Common Stock,3.0,2,no,no,17.0,11.08,0.534
2853,SCU,"Sculptor Capital Management, Inc. Class A Common Stock",2.5,1,1,no,32.0,18.55,0.725
2854,SCVX,SCVX Corp. Class A Ordinary Shares,n/a,n/a,n/a,n/a,n/a,n/a,n/a
2855,SCVX.U,"SCVX Corp. Units, each consisting of one Class A ordinary share, $0.0001 par value per share, and one-half of one redeemable warrant",n/a,n/a,n/a,n/a,n/a,n/a,n/a
2856,SCVX.W,"SCVX Corp. Redeemable warrants, each whole warrant exercisable for one Class A ordinary share at an exercise price of $11.50",n/a,n/a,n/a,n/a,n/a,n/a,n/a
2857,SCX,L.S. Starrett Company (The) Common Stock,n/a,n/a,n/a,n/a,n/a,n/a,n/a
2858,SD,"SandRidge Energy, Inc. Common Stock",n/a,n/a,n/a,n/a,n/a,n/a,n/a
2859,SDPI,"Superior Drilling Products, Inc. Common Stock",n/a,n/a,n/a,n/a,n/a,n/a,n/a
2860,SDYL,ETRACS Monthly Pay 2xLeveraged S&P Dividend ETN,n/a,n/a,n/a,n/a,n/a,n/a,n/a
2861,SE,"Sea Limited American Depositary Shares, each representing one Class A Ordinary Share",2.92,11,1,no,370.8,265.79,0.395
2862,SEAS,"SeaWorld Entertainment, Inc. Common Stock",2.78,7,2,no,67.4,61.01,0.105
2863,SEB,Seaboard Corporation Common Stock,n/a,n/a,n/a,n/a,n/a,n/a,n/a
2864,SEE,Sealed Air Corporation Common Stock,2.56,9,7,no,62.29,61.79,0.008
2865,SEM,Select Medical Holdings Corporation Common Stock,2.75,3,1,no,42.75,26.96,0.5860000000000001
2866,SENS,"Senseonics Holdings, Inc. Common Stock",2.14,3,2,2,3.3,2.99,0.10400000000000001
2867,SERV,"ServiceMaster Global Holdings, Inc. Common Stock",n/a,n/a,n/a,n/a,n/a,n/a,n/a
2868,SF,Stifel Financial Corporation Common Stock,2.17,2,3,1,71.73,71.14,0.008
2869,SF$A,"Stifel Financial Corporation Depositary Shares, each representing a 1/1000th interest in a share of 6.25% Non-Cumulative Preferred Stock, Series A",n/a,n/a,n/a,n/a,n/a,n/a,n/a
2870,SF$B,"Stifel Financial Corporation Depositary Shares, Each Representing 1/1,000th  Interest in a Share of 6.25% Non-Cumulative  Preferred Stock, Series B",n/a,n/a,n/a,n/a,n/a,n/a,n/a
2871,SF$C,"Stifel Financial Corporation Depositary Shares, Each Representing 1/1,000th Interest in a Share of 6.125% Non Cumulative Preferred Stock, Series C",n/a,n/a,n/a,n/a,n/a,n/a,n/a
2872,SFB,Stifel Financial Corporation 5.20% Senior Notes due 2047,n/a,n/a,n/a,n/a,n/a,n/a,n/a
2873,SFE,"Safeguard Scientifics, Inc. New Common Stock",n/a,n/a,n/a,n/a,n/a,n/a,n/a
2874,SFL,SFL Corporation Ltd,2.67,2,1,no,9.0,8.2,0.098
2875,SFTW,Osprey Technology Acquisition Corp. Class A Common Stock,3.0,1,no,no,20.0,8.49,1.3559999999999999
2876,SFTW.U,"Osprey Technology Acquisition Corp. Units, each consisting of one share of Class A Common Stock and one-half of one redeemable Warrant",n/a,n/a,n/a,n/a,n/a,n/a,n/a
2877,SFTW.W,"Osprey Technology Acquisition Corp. Redeemable Warrants, each whole Warrant exercisable for one share of Class A Common Stock",n/a,n/a,n/a,n/a,n/a,n/a,n/a
2878,SFUN,"Fang Holdings Limited American Depositary Shares (Each representing Four Class A Ordinary Shares, HK$1.00 par value)",n/a,n/a,n/a,n/a,n/a,n/a,n/a
2879,SGG,iPathA Series B Bloomberg Sugar Subindex Total Return ETN,n/a,n/a,n/a,n/a,n/a,n/a,n/a
2880,SGU,Star Group L.P. Common Stock,n/a,n/a,n/a,n/a,n/a,n/a,n/a
2881,SHAK,"Shake Shack, Inc. Class A Common Stock",2.29,7,8,2,94.41,72.45,0.303
2882,SHG,Shinhan Financial Group Co Ltd American Depositary Shares,n/a,n/a,n/a,n/a,n/a,n/a,n/a
